<?xml version="1.0"?>
<!DOCTYPE tsung SYSTEM "/home/aleksandra.lipiec/tsung_dist/share/tsung/tsung-1.0.dtd">
<tsung loglevel="error" version="1.0" dumptraffic="false">

  <clients>
    <client host="localhost" use_controller_vm="true" maxusers="60000"/>
  </clients>

  <servers>
    <server host="10.152.0.111" port="5222" type="tcp"></server>
  </servers>

  <load>
    <arrivalphase phase="1" duration="90" unit="minute">
      <users interarrival="0.02" unit="second"></users>
    </arrivalphase>
  </load>

  <options>
    <option type="ts_jabber" name="global_number" value="50000"></option>
    <option type="ts_jabber" name="userid_max" value="50000"></option>
    <option type="ts_jabber" name="domain" value="localhost"></option>
    <option type="ts_jabber" name="username" value="buser"></option>
    <option type="ts_jabber" name="passwd" value="pass"></option>
  </options>

  <sessions>
    <session name="inactive-user" probability="100" type="ts_jabber">

      <request subst="true">
        <jabber type="connect" ack="no_ack" />
      </request>

      <thinktime value="1" />

      <request subst="true">
        <jabber type="auth_get" ack="no_ack" />
      </request>

      <thinktime value="1" />

      <request subst="true">
        <jabber type="auth_set_plain" ack="no_ack" />
      </request>

      <thinktime value="1" />

      <request subst="true">
        <jabber type="presence:initial" ack="no_ack"/>
      </request>

      <thinktime value="20" />

      <for from="1" to="1000" incr="1" var="i"> 
        
        <for from="1" to="12" incr="1" var="j">
           <request subst="true">
              <jabber type="chat" ack="no_ack" size="50" destination="online"/>
           </request>
           <thinktime value="10"/>
        </for>

        <request subst="true">
          <jabber type="presence:final" ack="no_ack"/>
        </request>

        <thinktime value="20" />

        <request subst="true">
          <jabber type="presence:initial" ack="no_ack"/>
        </request>

     </for> 

     <request> <jabber type="close" ack="local"/> </request>
 
    </session>

  </sessions>
</tsung>
